dialogue_id,fallacy,clip_path,ref_text,whisper_text,wer,ref_len,whisper_len
26_2000,AppealtoEmotion,/workspace/patootie_code/mm_argfallacy/data/MMUSED-fallacy/audio_clips/26_2000/247.wav,"If that is not confirmed and does not happen, then I think the United States, with its European allies, ought to do everything we can to encourage the people of Serbia to do exactly what they've been doing over the last few days to rise up and end this reign of terror by Milosevic, and bring themselves back into the family of nations where they will be welcomed by the United States and others.","If that is not confirmed and does not happen, then I think the United States, with its European allies, ought to do everything we can to encourage the people of Serbia to do exactly what they've been doing over the last few days, to rise up and end this reign of terror by Milosevic and bring themselves back into the family of nations where they will be welcomed by the United States and others.",0.0,74,74
26_2000,AppealtoEmotion,/workspace/patootie_code/mm_argfallacy/data/MMUSED-fallacy/audio_clips/26_2000/275.wav,I think this is an opportunity for the United States to test President Putin of Russia.,I think this is an opportunity for the United States to test President Putin of Russia.,0.0,16,16
26_2000,AppealtoEmotion,/workspace/patootie_code/mm_argfallacy/data/MMUSED-fallacy/audio_clips/26_2000/278.wav,And it's a test for him whether he represents the old guard in the Soviet Union.,"And it's a test for him, in effect, or whether he represents the old guard in the Soviet Union.",0.1875,16,19
26_2000,AppealtoEmotion,/workspace/patootie_code/mm_argfallacy/data/MMUSED-fallacy/audio_clips/26_2000/296.wav,"That is a legitimate concern, this is a very important area.",That is a legitimate concern and this is a very important area.,0.0909090909090909,11,12
26_2000,AppealtoEmotion,/workspace/patootie_code/mm_argfallacy/data/MMUSED-fallacy/audio_clips/26_2000/316.wav,I have enormous regard for the men and women of the U. S. military.,I have enormous regard for the men and women of the U.S. military.,0.1428571428571428,14,13
26_2000,Slogans,/workspace/patootie_code/mm_argfallacy/data/MMUSED-fallacy/audio_clips/26_2000/348.wav,"There's still fewer people in uniform today, but person-to-person, person-by-person, unit-by-unit, this is the most powerful and effective military, not only in the world today, but in the history of the world.","There are fewer people in uniform today, but person to person, person by person, unit by unit, this is the most powerful and effective military, not only in the world today, but in the history of the world.",0.34375,32,38
26_2000,Slipperyslope,/workspace/patootie_code/mm_argfallacy/data/MMUSED-fallacy/audio_clips/26_2000/348.wav,"There's still fewer people in uniform today, but person-to-person, person-by-person, unit-by-unit, this is the most powerful and effective military, not only in the world today, but in the history of the world.","There are fewer people in uniform today, but person to person, person by person, unit by unit, this is the most powerful and effective military, not only in the world today, but in the history of the world.",0.34375,32,38
26_2000,AppealtoEmotion,/workspace/patootie_code/mm_argfallacy/data/MMUSED-fallacy/audio_clips/26_2000/372.wav,They used to fish in troubled waters whenever they had the opportunity in the Middle East.,"They used to fish in troubled waters whenever they had the opportunity in the Middle East. But with the end of the Soviet Union, the implosion, if you will, of the empire, that created a vacuum, if you will, and made it easier for us to operate there.",2.0,16,48
26_2000,Slipperyslope,/workspace/patootie_code/mm_argfallacy/data/MMUSED-fallacy/audio_clips/26_2000/367.wav,Numerous administrations going back certainly to World War II have had to wrestle with the problem of what should happen to the Middle East.,and numerous administrations going back certainly to World War II have had to wrestle with the problem of what should happen in the Middle East.,0.0833333333333333,24,25
26_2000,AppealtoEmotion,/workspace/patootie_code/mm_argfallacy/data/MMUSED-fallacy/audio_clips/26_2000/388.wav,We might have no other choice. We'll have to see if that happens.,We might have no other choice.,0.5384615384615384,13,6
26_2000,AppealtoEmotion,/workspace/patootie_code/mm_argfallacy/data/MMUSED-fallacy/audio_clips/26_2000/390.wav,"The thing about Iraq, of course, was at the end of the war we had pretty well decimated their military.","The thing about Iraq, of course, was at the end of the war, we had pretty well decimated their military.",0.0,20,20
26_2000,AppealtoEmotion,/workspace/patootie_code/mm_argfallacy/data/MMUSED-fallacy/audio_clips/26_2000/392.wav,"We had a strong international coalition raid against them, effective economic sanctions, and a very robust inspection regime was in place under the U. N. auspices and it was able to do a good job of stripping out the capacity to build weapons of mass destruction, the work he had been doing that had not been destroyed during the war in biological and chemical agents, as well as a nuclear program.","We had a strong international coalition, a raid against them, effective economic sanctions, and a very robust inspection regime that was in place so that the inspection regime under UN auspices was able to do a good job of stripping out the capacity to build weapons of mass destruction, the work that he'd been doing that had not been destroyed during the war on biological chemical agents as well as a nuclear program.",0.1830985915492957,71,73
26_2000,AppealtoEmotion,/workspace/patootie_code/mm_argfallacy/data/MMUSED-fallacy/audio_clips/26_2000/401.wav,"It would, of course, be a very serious situation if we had evidence, credible evidence, that Saddam Hussein was developing weapons of mass destruction.","Bernie, it would of course be a very serious situation if we had evidence, credible evidence, that Saddam Hussein was developing weapons of mass destruction.",0.0416666666666666,24,25
26_2000,AppealtoEmotion,/workspace/patootie_code/mm_argfallacy/data/MMUSED-fallacy/audio_clips/26_2000/417.wav,"We are supporting them in their efforts and will continue to support them until the Iraqi people rise up and do what the people of Serbia have done in the last few days, get rid of a despot. We'll welcome you back into the family of nations where you belong.","We are supporting them in their efforts, and we will continue to support them until the Iraqi people rise up and do what the people of Serbia have done in the last few days, get rid of a despot.",0.26,50,39
26_2000,AppealtoEmotion,/workspace/patootie_code/mm_argfallacy/data/MMUSED-fallacy/audio_clips/26_2000/453.wav,Even with more crude available they're probably not going to be able to do very much by way of producing additional home heating oil for this winter.,"And the refineries are now operating at 96 or 97 percent of capacity, which means even with more crude available, they're probably not going to be able to do very much by way of producing additional home heating oil for this winter.",0.5555555555555556,27,42
26_2000,AppealtoEmotion,/workspace/patootie_code/mm_argfallacy/data/MMUSED-fallacy/audio_clips/26_2000/476.wav,"We set aside a part of Wyoming, nearly a million acres of wilderness that ought to be separate and not be developed.","We set aside a part of Wyoming, nearly a million acres of wilderness that ought to be separate and not be developed.",0.0,22,22
26_2000,AppealtoEmotion,/workspace/patootie_code/mm_argfallacy/data/MMUSED-fallacy/audio_clips/26_2000/533.wav,It's been a fantastic program and has been there for 65 years that has provided benefits for senior citizens over that period of time.,It's been a fantastic program.,0.7916666666666666,24,5
27_2000,AppealtoEmotion,/workspace/patootie_code/mm_argfallacy/data/MMUSED-fallacy/audio_clips/27_2000/49.wav,"We have the strongest military, and I'll do whatever is necessary, if I'm president, to make sure that it stays that way.",We have the strongest military and I'll do whatever is necessary if I'm president to make sure that it stays that way.,0.0,22,22
27_2000,AppealtoEmotion,/workspace/patootie_code/mm_argfallacy/data/MMUSED-fallacy/audio_clips/27_2000/65.wav,"I think that one of the problems that we have faced in the world is that we are so much more powerful than any single nation has been in relationship to the rest of the world than at any time in history, that I know about, anyway.",I think that one of the problems that we have faced in the world is that we are so much more powerful than any single nation has been in relationship to the rest of the world than at any time in history.,0.1063829787234042,47,42
27_2000,AppealtoEmotion,/workspace/patootie_code/mm_argfallacy/data/MMUSED-fallacy/audio_clips/27_2000/71.wav,"You know, in the last, or two decades ago, it was routine for leaders of foreign countries to come over here and say you guys have got to do something about these horrendous deficits because it's causing tremendous problems for the rest of the world, and we were lectured to all the time.","You know, in the last two decades ago, it was routine for leaders of foreign countries to come over here and say, you guys have got to do something about these horrendous deficits because it's causing tremendous problems for the rest of the world.",0.1698113207547169,53,44
27_2000,FalseCause,/workspace/patootie_code/mm_argfallacy/data/MMUSED-fallacy/audio_clips/27_2000/43.wav,"The power of example is America's greatest power in the world. And that means, for example, standing up for human rights. It means addressing the problems of injustice and inequity, along the lines of race and ethnicity here at home, because in all these other places around the world where they're having these terrible problems, when they feel hope, it is often because they see in us a reflection of their potential.",The power of example is America's greatest power in the world.,0.8472222222222222,72,11
27_2000,AppealtoEmotion,/workspace/patootie_code/mm_argfallacy/data/MMUSED-fallacy/audio_clips/27_2000/101.wav,Our bonds with Israel are larger than agreements or disagreements on some details of diplomatic initiatives.,Our bonds with Israel are larger than agreements or disagreements on some details of diplomatic initiatives.,0.0,16,16
27_2000,AppealtoEmotion,/workspace/patootie_code/mm_argfallacy/data/MMUSED-fallacy/audio_clips/27_2000/102.wav,"They are historic, they are strong, and they are enduring.","They are historic, they are strong, and they are enduring.",0.0,10,10
27_2000,AppealtoEmotion,/workspace/patootie_code/mm_argfallacy/data/MMUSED-fallacy/audio_clips/27_2000/108.wav,I want everybody to know should I be the president Israel's going to be our friend.,"I want everybody to know, should I be the president? Israel's going to be our friend.",0.0,16,16
27_2000,AppealtoEmotion,/workspace/patootie_code/mm_argfallacy/data/MMUSED-fallacy/audio_clips/27_2000/109.wav,I'm going to stand by Israel.,I'm gonna stand by Israel.,0.3333333333333333,6,5
27_2000,AppealtoEmotion,/workspace/patootie_code/mm_argfallacy/data/MMUSED-fallacy/audio_clips/27_2000/115.wav,We don't know whether he's developing weapons of mass destruction.,We don't know whether he's developing weapons of mass destruction.,0.0,10,10
27_2000,AppealtoEmotion,/workspace/patootie_code/mm_argfallacy/data/MMUSED-fallacy/audio_clips/27_2000/145.wav,He is a danger.,He is a danger.,0.0,4,4
27_2000,AppealtoEmotion,/workspace/patootie_code/mm_argfallacy/data/MMUSED-fallacy/audio_clips/27_2000/94.wav,"The use of diplomacy in this situation has already, well, it goes hour-by-hour and day-by-day now. It's a very tense situation there.","The use of diplomacy in this situation has already, well it goes hour by hour and day by day now, it's a very tense situation there, but in the last 24 hours there has been some subsiding of the violence there.",0.9545454545454546,22,41
27_2000,AppealtoEmotion,/workspace/patootie_code/mm_argfallacy/data/MMUSED-fallacy/audio_clips/27_2000/108.wav,I want everybody to know should I be the president Israel's going to be our friend. I'm going to stand by Israel.,"I want everybody to know, should I be the president? Israel's going to be our friend.",0.2727272727272727,22,16
27_2000,AppealtoEmotion,/workspace/patootie_code/mm_argfallacy/data/MMUSED-fallacy/audio_clips/27_2000/115.wav,We don't know whether he's developing weapons of mass destruction.,We don't know whether he's developing weapons of mass destruction.,0.0,10,10
27_2000,AppealtoEmotion,/workspace/patootie_code/mm_argfallacy/data/MMUSED-fallacy/audio_clips/27_2000/146.wav,We don't want him fishing in troubled waters in the Middle East.,We don't want him fishing in troubled waters in the Middle East. And it's going to be important to rebuild that coalition to keep the pressure on him.,1.3333333333333333,12,28
27_2000,AppealtoAuthority,/workspace/patootie_code/mm_argfallacy/data/MMUSED-fallacy/audio_clips/27_2000/156.wav,"I know the governor's not necessarily saying that but, you know, all of these flights that have come in, all of them have been in accordance with the sanctions regime, I'm told, except for three where they notified, and they're trying to break out of the box, there's no question about it.",and they're trying to break out of the box.,0.8269230769230769,52,9
27_2000,AppealtoEmotion,/workspace/patootie_code/mm_argfallacy/data/MMUSED-fallacy/audio_clips/27_2000/262.wav,"The administration, seems like we're having a great love fest tonight, but the administration made the right decision on training Nigerian troops for situations just such as this in Rwanda, and so I thought they made the right decision not to send U. S. troops into Rwanda.","The administration, it seems like we're having a great love fest tonight, but the administration made the right decision on training Nigerian troops for situations just such as this in Rwanda. And so I thought they made the right decision not to send U.S. troops into Rwanda.",0.0638297872340425,47,47
27_2000,AppealtoEmotion,/workspace/patootie_code/mm_argfallacy/data/MMUSED-fallacy/audio_clips/27_2000/356.wav,"But if you have a situation like that right in our backyard with chaos about to break out and flotillas forming to come across the water, and all kinds of violence there, right in one of our neighboring countries there, then I think that we did the right thing there.","But if you have a situation like that right in our backyard with chaos about to break out and flotillas forming to come across the water and all kinds of violence there, right in one of our neighboring countries there, then I think that we did the right thing there.",0.0,50,50
27_2000,AppealtoEmotion,/workspace/patootie_code/mm_argfallacy/data/MMUSED-fallacy/audio_clips/27_2000/376.wav,"I think a lot of times we just spend aid and say we feel better about it and it ends up being spent the wrong way, and there's some pretty egregious examples recently.",I think a lot of times we just spend aid and say we feel better about it and it ends up being spent the wrong way.,0.2121212121212121,33,26
27_2000,AppealtoEmotion,/workspace/patootie_code/mm_argfallacy/data/MMUSED-fallacy/audio_clips/27_2000/380.wav,I thought the President did the right thing with Mexico and was very strongly supportive of the administration in Mexico.,"I thought the president did the right thing with Mexico, and it was very strongly supportive of the administration in Mexico.",0.05,20,21
27_2000,AppealtoEmotion,/workspace/patootie_code/mm_argfallacy/data/MMUSED-fallacy/audio_clips/27_2000/394.wav,"I just think, Jim, that this is an absolutely unique period in world history. The worldâ€™s coming together, as I said, they're looking to us.","I just think, Jim, that this is an absolutely unique period in world history.",0.44,25,14
27_2000,AppealtoEmotion,/workspace/patootie_code/mm_argfallacy/data/MMUSED-fallacy/audio_clips/27_2000/397.wav,"Are we going to step up to the plate as a nation the way we did after World War II, the way that generation of heroes said okay, the United States is going to be the leader. And the world benefitted tremendously from the courage that they showed in those post-war years.","Are we going to step up to the plate as a nation, the way we did after World War II, the way that generation of heroes said, okay, the United States is going to be the leader.",0.2884615384615384,52,37
27_2000,AppealtoEmotion,/workspace/patootie_code/mm_argfallacy/data/MMUSED-fallacy/audio_clips/27_2000/418.wav,"We know freedom is a powerful, powerful, powerful force, much bigger than the United States of America, as we saw recently in the Balkans.","We know freedom is a powerful force, much bigger than the United States of America, as we saw recently in the Balkans.",0.0833333333333333,24,22
27_2000,AppealtoAuthority,/workspace/patootie_code/mm_argfallacy/data/MMUSED-fallacy/audio_clips/27_2000/267.wav,"My wife Tipper, who is here, actually went on a military plane with General Sholicatchvieli on one of those flights.","My wife, Tipper, who's here, actually went on a military plane with General Shalikashvili on one of those flights.",0.15,20,19
27_2000,AppealtoEmotion,/workspace/patootie_code/mm_argfallacy/data/MMUSED-fallacy/audio_clips/27_2000/444.wav,"But it's very important that we not overstep our bounds and I think most people -- most police officers are good, dedicated, honorable citizens who are doing their job, putting their lives at risk who aren't bigoted or aren't prejudiced.","But it's very important that we not overstep our bounds. And I think most people, most police officers, are good, dedicated, honorable citizens who are doing their job, putting their lives at risk, who aren't bigoted or aren't prejudiced.",0.0,39,39
27_2000,AppealtoEmotion,/workspace/patootie_code/mm_argfallacy/data/MMUSED-fallacy/audio_clips/27_2000/456.wav,"And as for singling people out because of race, you know, James Byrd was singled out because of his race in Texas.","And as for singling people out because of race, you know James Byrd was singled out because of his race in Texas.",0.0,22,22
27_2000,AppealtoEmotion,/workspace/patootie_code/mm_argfallacy/data/MMUSED-fallacy/audio_clips/27_2000/480.wav,"I believe, though -- I believe, as sure as I'm sitting here, that most Americans really care. They're tolerant people. They're good, tolerant people.","I believe, though, I believe, sure as I'm sitting here, that most Americans really care.",0.3478260869565217,23,15
27_2000,AppealtoEmotion,/workspace/patootie_code/mm_argfallacy/data/MMUSED-fallacy/audio_clips/27_2000/492.wav,"And to make sure our society is as hopeful as it possibly can be, every single child in America must be educated. I mean every child.","And to make sure our society is as hopeful as it possibly can be, every single child in America must be educated.",0.1538461538461538,26,22
27_2000,AppealtoEmotion,/workspace/patootie_code/mm_argfallacy/data/MMUSED-fallacy/audio_clips/27_2000/510.wav,There is nothing more prejudiced than not educating a child.,There's nothing more prejudice than not educating a child.,0.3,10,9
27_2000,AppealtoAuthority,/workspace/patootie_code/mm_argfallacy/data/MMUSED-fallacy/audio_clips/27_2000/453.wav,"I talked to an African-American police officer in Springfield, Massachusetts not long ago who raised this question and said that in his opinion one of the biggest solutions is in the training.","I talked to an African American police officer in Springfield, Massachusetts not long ago who raised this question and said that in his opinion one of the biggest solutions is in the training.",0.0625,32,33
27_2000,AppealtoAuthority,/workspace/patootie_code/mm_argfallacy/data/MMUSED-fallacy/audio_clips/27_2000/488.wav,"My friend, Phyllis Hunter, is here. She had one of the greatest lines of all lines. She said, reading is the new civil right. She's right.","My friend, Phyllis Hunter, is here.",0.7692307692307693,26,6
27_2000,AppealtoAuthority,/workspace/patootie_code/mm_argfallacy/data/MMUSED-fallacy/audio_clips/27_2000/566.wav,"But I think that we should find a way to allow some kind of civic unions, and I basically agree with Dick Cheney and Joe Lieberman.",But I think that we should find a way to allow some kind of civic unions. And I basically agree with Dick Cheney and Joe Lieberman.,0.0,26,26
27_2000,AppealtoEmotion,/workspace/patootie_code/mm_argfallacy/data/MMUSED-fallacy/audio_clips/27_2000/602.wav,I will not do anything to affect the rights of hunters or sportsmen.,I will not do anything to affect the rights of hunters or sportsmen.,0.0,13,13
27_2000,AppealtoEmotion,/workspace/patootie_code/mm_argfallacy/data/MMUSED-fallacy/audio_clips/27_2000/657.wav,"Look, this is the year -- this is in the aftermath of Columbine, and Paducah, and all the places in our country where the nation has been shocked by these weapons in the hands of the wrong people.","And look, this is in the aftermath of Columbine and Paducah and all of the places around our country where the nation has been shocked by these weapons in the hands of the wrong people.",0.1891891891891892,37,35
27_2000,AppealtoEmotion,/workspace/patootie_code/mm_argfallacy/data/MMUSED-fallacy/audio_clips/27_2000/658.wav,"The woman who bought the guns for the two boys who did that killing at Columbine said that if she had had to give her name and fill out a form there, she would not have bought those guns.","The woman who bought the guns for the two boys who did that killing at Columbine said that if she had had to give her name and fill out a form there, she would not have bought those guns.",0.0,39,39
27_2000,AppealtoEmotion,/workspace/patootie_code/mm_argfallacy/data/MMUSED-fallacy/audio_clips/27_2000/675.wav,"Some desperate child needs to have somebody put their arm around them and say, we love you.","somebody, some desperate child, it needs to have somebody put their arm around and say, we love you.",0.1764705882352941,17,18
27_2000,AppealtoEmotion,/workspace/patootie_code/mm_argfallacy/data/MMUSED-fallacy/audio_clips/27_2000/692.wav,And the reason it's so difficult for schools to control that is because in recent years there has been a flood of cheap handguns that are so widely available that kids are finding ways to get ahold of them.,And the reason it's so difficult for schools to control that is because in recent years there has been a flood of cheap handguns that are so widely available that kids are finding ways to get a hold of them.,0.0512820512820512,39,40
27_2000,AppealtoAuthority,/workspace/patootie_code/mm_argfallacy/data/MMUSED-fallacy/audio_clips/27_2000/654.wav,"And the ""Los Angeles Times"" spent a lot of ink going into that.",There was a recent investigation of the number in Texas who were given concealed weapons permits in spite of the fact that they had records and the Los Angeles Times spent a lot of ink going into that.,1.9230769230769231,13,38
27_2000,AppealtoAuthority,/workspace/patootie_code/mm_argfallacy/data/MMUSED-fallacy/audio_clips/27_2000/685.wav,Tipper and I have worked on the problem of violence in entertainment aimed at children. She's worked on it longer than I have.,Tipper and I have worked on the problem of violence and entertainment aimed at children.,0.391304347826087,23,15
27_2000,AppealtoEmotion,/workspace/patootie_code/mm_argfallacy/data/MMUSED-fallacy/audio_clips/27_2000/829.wav,"And my case to the American people is, if you're happy with inactivity, stay with the horse.","And my case to the American people is, if you're happy with inactivity, stay with the horse.",0.0,17,17
27_2000,AppealtoAuthority,/workspace/patootie_code/mm_argfallacy/data/MMUSED-fallacy/audio_clips/27_2000/734.wav,"And the budget plan that I've put out, according to the ""Los Angeles Times"" again, the way these things are typically measured as a percentage of the GDP, will bring government spending down to the lowest level in 50 years.","The budget plan that I've put out, according to the Los Angeles Times, again, the way these things are typically measured as a percentage of the GDP, will bring government spending down to the lowest level in 50 years.",0.025,40,39
27_2000,AppealtoAuthority,/workspace/patootie_code/mm_argfallacy/data/MMUSED-fallacy/audio_clips/27_2000/780.wav,Let me just tell you who the jury is. The people of Texas.,And let me just tell you who the jury is.,0.3846153846153846,13,10
27_2000,AppealtoAuthority,/workspace/patootie_code/mm_argfallacy/data/MMUSED-fallacy/audio_clips/27_2000/783.wav,"And I was able to do so with a lot of Democrat votes, nearly 50% of the Hispanic vote, about 27% of the African-American vote, because people know I'm a conservative person and a compassionate person.","And I was able to do so with a lot of Democrat votes, nearly 50% of the Hispanic vote, about 27% of the African American vote, because people know that I'm a conservative person and a compassionate person.",0.0833333333333333,36,38
27_2000,AdHominem,/workspace/patootie_code/mm_argfallacy/data/MMUSED-fallacy/audio_clips/27_2000/748.wav,"First of all, let me say he's not for a government-run health care system?","Well, first of all, let me say he's not for a government-run health care system.",0.0714285714285714,14,15
27_2000,AppealtoEmotion,/workspace/patootie_code/mm_argfallacy/data/MMUSED-fallacy/audio_clips/27_2000/843.wav,You know the Japanese are breathing down our necks on this.,"You know, the Japanese are breathing down our necks on this.",0.0,11,11
27_2000,Slogans,/workspace/patootie_code/mm_argfallacy/data/MMUSED-fallacy/audio_clips/27_2000/935.wav,"In my faith tradition, it is -- it's written in the book of Matthew, ""Where your heart is, there is your treasure also.""","In my faith tradition, it's written in the book of Matthew, where your heart is, there is your treasure also.",0.0909090909090909,22,20
