dialogue_id,fallacy,clip_path,ref_text,whisper_text,wer,ref_len,whisper_len
33_2008,AppealtoEmotion,/workspace/patootie_code/mm_argfallacy/data/MMUSED-fallacy/audio_clips/33_2008/194.wav,"And when you look at your tax policies that are directed primarily at those who are doing well, and you are neglecting people who are really struggling right now, I think that is a continuation of the last eight years, and we can't afford another four.","And when you look at your tax policies that are directed primarily at those who are doing well and you are neglecting people who are really struggling right now, I think that is a continuation of the last eight years and we can't afford another four.",0.0,46,46
33_2008,AppealtoEmotion,/workspace/patootie_code/mm_argfallacy/data/MMUSED-fallacy/audio_clips/33_2008/206.wav,"The United States Senate will take up a continuing resolution tomorrow or the next day, sometime next week, with 2,000 -- 2,000 -- look at them, my friends. Look at them. You'll be appalled.","The United States Senate will take up a continuing resolution tomorrow or the next day, sometime next week, with 2,000.",0.375,32,20
33_2008,AppealtoEmotion,/workspace/patootie_code/mm_argfallacy/data/MMUSED-fallacy/audio_clips/33_2008/242.wav,Who fought against wasteful and earmark spending?,who fought against wasteful and earmarked spending.,0.1428571428571428,7,7
33_2008,AppealtoAuthority,/workspace/patootie_code/mm_argfallacy/data/MMUSED-fallacy/audio_clips/33_2008/31.wav,"Now, we also have to recognize that this is a final verdict on eight years of failed economic policies promoted by George Bush, supported by Senator McCain, a theory that basically says that we can shred regulations and consumer protections and give more and more to the most, and somehow prosperity will trickle down. It hasn't worked.","We also have to recognize that this is a final verdict on eight years of failed economic policies promoted by George Bush, supported by Senator McCain, a theory that basically says that we can shred regulations and consumer protections and give more and more to the most and somehow prosperity will trickle down.",0.0701754385964912,57,53
33_2008,AppealtoAuthority,/workspace/patootie_code/mm_argfallacy/data/MMUSED-fallacy/audio_clips/33_2008/161.wav,"And over time, that, I think, is going to be a better recipe for economic growth than the -- the policies of President Bush that John McCain wants to -- wants to follow.","And over time, that I think is going to be a better recipe for economic growth than the policies of President Bush that John McCain wants to follow.",0.0967741935483871,31,28
33_2008,AdHominem,/workspace/patootie_code/mm_argfallacy/data/MMUSED-fallacy/audio_clips/33_2008/138.wav,And we have former members of Congress now residing in federal prison because of the evils of this earmarking and pork-barrel spending.,And we have former members of Congress now residing in federal prison because of the evils of this year marking and pork barrel spending.,0.1818181818181818,22,24
33_2008,AppealtoAuthority,/workspace/patootie_code/mm_argfallacy/data/MMUSED-fallacy/audio_clips/33_2008/474.wav,"Senator McCain cut -- Senator McCain opposed funding for troops in legislation that had a timetable, because he didn't believe in a timetable.","Senator McCain cut, Senator McCain opposed funding for troops in legislation that had a timetable because he didn't believe in a timetable.",0.0,22,22
33_2008,AppealtoAuthority,/workspace/patootie_code/mm_argfallacy/data/MMUSED-fallacy/audio_clips/33_2008/494.wav,Admiral Mullen suggests that Senator Obama's plan is dangerous for America.,Admiral Mullen suggests that Senator Obama's plan is dangerous for us.,0.0909090909090909,11,11
33_2008,FalseCause,/workspace/patootie_code/mm_argfallacy/data/MMUSED-fallacy/audio_clips/33_2008/382.wav,"Our initial military success, we went in to Baghdad and everybody celebrated. And then the war was very badly mishandled. I went to Iraq in 2003 and came back and said, we've got to change this strategy. This strategy requires additional troops, it requires a fundamental change in strategy and I fought for it. And finally, we came up with a great general and a strategy that has succeeded. This strategy has succeeded. And we are winning in Iraq.",our initial military success. We went into Baghdad and everybody celebrated.,0.8734177215189873,79,11
33_2008,FalseCause,/workspace/patootie_code/mm_argfallacy/data/MMUSED-fallacy/audio_clips/33_2008/407.wav,"We have lost over 4,000 lives. We have seen 30,000 wounded, and most importantly, from a strategic national security perspective, al Qaeda is resurgent, stronger now than at any time since 2001.","We've spent over $600 billion so far, soon to be a trillion. We have lost over 4,000 lives.",0.9375,32,18
33_2008,AppealtoEmotion,/workspace/patootie_code/mm_argfallacy/data/MMUSED-fallacy/audio_clips/33_2008/514.wav,And we are seeing a major offensive taking place -- Al Qaida and Taliban crossing the border and attacking our troops in a brazen fashion.,"And we are seeing major offensive taking place, Al Qaeda and Taliban crossing the border and attacking our troops in a brazen fashion.",0.0833333333333333,24,23
33_2008,AppealtoEmotion,/workspace/patootie_code/mm_argfallacy/data/MMUSED-fallacy/audio_clips/33_2008/525.wav,"Number three, we've got to deal with Pakistan, because Al Qaida and the Taliban have safe havens in Pakistan, across the border in the northwest regions, and although, you know, under George Bush, with the support of Senator McCain, we've been giving them $10 billion over the last seven years, they have not done what needs to be done to get rid of those safe havens.","Number three, we've got to deal with Pakistan, because al Qaeda and the Taliban have safe havens in Pakistan, across the border in the northwest regions. And although under George Bush, with the support of Senator McCain, we've been giving them $10 billion over the last seven years, they have not done what needs to be done to get rid of those safe havens.",0.0454545454545454,66,64
33_2008,AppealtoEmotion,/workspace/patootie_code/mm_argfallacy/data/MMUSED-fallacy/audio_clips/33_2008/528.wav,"First of all, I won't repeat the mistake that I regret enormously, and that is, after we were able to help the Afghan freedom fighters and drive the Russians out of Afghanistan, we basically washed our hands of the region.","First of all, I won't repeat the mistake that I regret enormously, and that is after we were able to help the Afghan freedom fighters and drive the Russians out of Afghanistan, we basically washed our hands of the region, and the result over time was the Taliban, Al-Qaeda, and a lot of the difficulties we are facing today.",0.475,40,59
33_2008,AppealtoEmotion,/workspace/patootie_code/mm_argfallacy/data/MMUSED-fallacy/audio_clips/33_2008/582.wav,"Tragically, I was right: Nearly 300 Marines lost their lives in the bombing of the barracks.","Tragically, I was right. Nearly 300 Marines lost their lives in the bombing of the barracks.",0.0,16,16
33_2008,AppealtoEmotion,/workspace/patootie_code/mm_argfallacy/data/MMUSED-fallacy/audio_clips/33_2008/606.wav,"She asked me, can you please make sure another mother is not going through what I'm going through.","And she asked me, can you please make sure that another mother is not going through what I'm going through.",0.1111111111111111,18,20
33_2008,AppealtoEmotion,/workspace/patootie_code/mm_argfallacy/data/MMUSED-fallacy/audio_clips/33_2008/611.wav,"And the point that I originally made is that we took our eye off Afghanistan, we took our eye off the folks who perpetrated 9/11, they are still sending out videotapes and Senator McCain, nobody is talking about defeat in Iraq, but I have to say we are having enormous problems in Afghanistan because of that decision.","And the point that I originally made is that we took our eye off Afghanistan, we took our eye off the folks who perpetrated 9-11. They are still sending out videotapes. And Senator McCain, nobody is talking about defeat in Iraq, but I have to say that we are having enormous problems in Afghanistan because of that decision.",0.0175438596491228,57,58
33_2008,AppealtoEmotion,/workspace/patootie_code/mm_argfallacy/data/MMUSED-fallacy/audio_clips/33_2008/623.wav,"But the important thing is, if we suffer defeat in Iraq, which General Petraeus predicts we will, if we adopted Senator Obama's set date for withdrawal, then that will have a calamitous effect in Afghanistan and American national security interests in the region.","But the important thing is, if we suffer defeat in Iraq, which General Petraeus predicts we will, if we adopted Senator Obama's set date for withdrawal, then that will have a calamitous effect on Afghanistan and American national security interest in the region.",0.0465116279069767,43,43
33_2008,AppealtoAuthority,/workspace/patootie_code/mm_argfallacy/data/MMUSED-fallacy/audio_clips/33_2008/532.wav,"I'm not prepared at this time to cut off aid to Pakistan. So I'm not prepared to threaten it, as Senator Obama apparently wants to do, as he has said that he would announce military strikes into Pakistan.",I'm not prepared at this time to cut off aid to Pakistan.,0.6842105263157895,38,12
33_2008,AppealtoAuthority,/workspace/patootie_code/mm_argfallacy/data/MMUSED-fallacy/audio_clips/33_2008/555.wav,It's a strategy that will succeed. And Pakistan is a very important element in this. And I know how to work with them. And I guarantee you I would not publicly state that I'm going to attack them.,"It's a strategy that will succeed, and Pakistan is a very important element in this. And I know how to work with them, and I guarantee you, I would not publicly state that I'm going to attack them.",0.0,38,38
33_2008,AppealtoAuthority,/workspace/patootie_code/mm_argfallacy/data/MMUSED-fallacy/audio_clips/33_2008/577.wav,I -- I don't think that Senator Obama understands that there was a failed state in Pakistan when Musharraf came to power.,I don't think that Senator Obama understands that there was a failed state in Pakistan when Musharraf came to power.,0.0476190476190476,21,20
33_2008,AppealtoAuthority,/workspace/patootie_code/mm_argfallacy/data/MMUSED-fallacy/audio_clips/33_2008/623.wav,"But the important thing is, if we suffer defeat in Iraq, which General Petraeus predicts we will, if we adopted Senator Obama's set date for withdrawal, then that will have a calamitous effect in Afghanistan and American national security interests in the region.","But the important thing is, if we suffer defeat in Iraq, which General Petraeus predicts we will, if we adopted Senator Obama's set date for withdrawal, then that will have a calamitous effect on Afghanistan and American national security interest in the region.",0.0465116279069767,43,43
33_2008,AppealtoEmotion,/workspace/patootie_code/mm_argfallacy/data/MMUSED-fallacy/audio_clips/33_2008/526.wav,"And until we do, Americans here at home are not going to be safe.","And until we do, Americans here at home are not going to be safe.",0.0,14,14
33_2008,AppealtoEmotion,/workspace/patootie_code/mm_argfallacy/data/MMUSED-fallacy/audio_clips/33_2008/592.wav,"And I'll tell you, I had a town hall meeting in Wolfeboro, New Hampshire, and a woman stood up and she said, ""Senator McCain, I want you to do me the honor of wearing a bracelet with my son's name on it."" He was 22 years old and he was killed in combat outside of Baghdad, Matthew Stanley, before Christmas last year. This was last August, a year ago. And I said, ""I will -- I will wear his bracelet with honor."" And this was August, a year ago. And then she said, ""But, Senator McCain, I want you to do everything -- promise me one thing, that you'll do everything in your power to make sure that my son's death was not in vain."" That means that that mission succeeds, just like those young people who re-enlisted in Baghdad, just like the mother I met at the airport the other day whose son was killed. And they all say to me that we don't want defeat.","I had a town hall meeting in Wolfboro, New Hampshire, and a woman stood up and she said, Senator McCain, I want you to do me the honor of wearing a bracelet with my son's name on it.",0.7757575757575758,165,38
33_2008,AppealtoEmotion,/workspace/patootie_code/mm_argfallacy/data/MMUSED-fallacy/audio_clips/33_2008/605.wav,"I've got a bracelet, too, from Sergeant - from the mother of Sergeant Ryan David Jopeck (ph), given to me in green bay. She asked me, can you please make sure another mother is not going through what I'm going through.","I've got a bracelet, too, from Sergeant, from the mother of Sergeant Ryan David Jopek, given to me in Green Bay.",0.5,40,21
33_2008,AppealtoEmotion,/workspace/patootie_code/mm_argfallacy/data/MMUSED-fallacy/audio_clips/33_2008/610.wav,"The question is for the next president, are we making good judgments about how to keep America safe precisely because sending our military into battle is such an enormous step.","The question is for the next president, are we making good judgments about how to keep America safe precisely because sending our military into battle is such an enormous step?",0.0,30,30
33_2008,AppealtoAuthority,/workspace/patootie_code/mm_argfallacy/data/MMUSED-fallacy/audio_clips/33_2008/531.wav,"Now, on this issue of aiding Pakistan, if you're going to aim a gun at somebody, George Shultz, our great secretary of state, told me once, you'd better be prepared to pull the trigger.","Now, on this issue of aiding Pakistan, if you're going to aim a gun at somebody, George Shultz, our great secretary of state, told me once, you better be prepared to pull the trigger.",0.0294117647058823,34,34
33_2008,AppealtoAuthority,/workspace/patootie_code/mm_argfallacy/data/MMUSED-fallacy/audio_clips/33_2008/623.wav,"But the important thing is, if we suffer defeat in Iraq, which General Petraeus predicts we will, if we adopted Senator Obama's set date for withdrawal, then that will have a calamitous effect in Afghanistan and American national security interests in the region.","But the important thing is, if we suffer defeat in Iraq, which General Petraeus predicts we will, if we adopted Senator Obama's set date for withdrawal, then that will have a calamitous effect on Afghanistan and American national security interest in the region.",0.0465116279069767,43,43
33_2008,AdHominem,/workspace/patootie_code/mm_argfallacy/data/MMUSED-fallacy/audio_clips/33_2008/624.wav,Senator Obama doesn't seem to understand there is a connected between the two.,President Obama doesn't seem to understand there's a connection between the two.,0.3076923076923077,13,12
33_2008,AppealtoEmotion,/workspace/patootie_code/mm_argfallacy/data/MMUSED-fallacy/audio_clips/33_2008/646.wav,So this is a serious threat.,So this is a serious threat.,0.0,6,6
33_2008,AppealtoEmotion,/workspace/patootie_code/mm_argfallacy/data/MMUSED-fallacy/audio_clips/33_2008/720.wav,This is dangerous. It isn't just naive; it's dangerous.,This is dangerous.,0.6666666666666666,9,3
33_2008,AppealtoEmotion,/workspace/patootie_code/mm_argfallacy/data/MMUSED-fallacy/audio_clips/33_2008/724.wav,"By the way, North Korea, most repressive and brutal regime probably on Earth.","By the way, North Korea, most repressive and brutal regime probably on earth.",0.0,13,13
33_2008,AppealtoAuthority,/workspace/patootie_code/mm_argfallacy/data/MMUSED-fallacy/audio_clips/33_2008/694.wav,"Again, it may not work, but if it doesn't work, then we have strengthened our ability to form alliances to impose the tough sanctions that Senator McCain just mentioned.","Again, it may not work, but if it doesn't work, then we have strengthened our ability to form alliances to impose the tough sanctions that Senator McCain just mentioned.",0.0,29,29
33_2008,AppealtoEmotion,/workspace/patootie_code/mm_argfallacy/data/MMUSED-fallacy/audio_clips/33_2008/865.wav,"I think it -- that we have a safer nation, but we are a long way from safe.","I think that we have a safer nation, but we are a long way from safe.",0.0588235294117647,17,16
33_2008,AppealtoEmotion,/workspace/patootie_code/mm_argfallacy/data/MMUSED-fallacy/audio_clips/33_2008/906.wav,We are less respected now than we were eight years ago or even four years ago.,We are less respected now than we were eight years ago or even four years ago.,0.0,16,16
33_2008,AppealtoEmotion,/workspace/patootie_code/mm_argfallacy/data/MMUSED-fallacy/audio_clips/33_2008/926.wav,"In the meantime, bin Laden is still out there. He is not captured. He is not killed.","In the meantime, bin Laden is still out there.",0.4705882352941176,17,9
33_2008,AppealtoEmotion,/workspace/patootie_code/mm_argfallacy/data/MMUSED-fallacy/audio_clips/33_2008/949.wav,"And I -- and I honestly don't believe that Senator Obama has the knowledge or experience and has made the wrong judgments in a number of areas, including his initial reaction to Russian invasion -- aggression in Georgia, to his -- you know, we've seen this stubbornness before in this administration to cling to a belief that somehow the surge has not succeeded and failing to acknowledge that he was wrong about the surge is -- shows to me that we -- that -- that we need more flexibility in a president of the United States than that.","And I honestly don't believe that Senator Obama has the knowledge or experience and has made the wrong judgments in a number of areas, including his initial reaction to Russian aggression in Georgia, to his, you know, we've seen the stubbornness before in this administration to cling to a belief that somehow the surge has not succeeded and failing to acknowledge that he was wrong about the surge shows to me that we need more flexibility in a president of the United States than that.",0.0869565217391304,92,85
33_2008,AppealtoAuthority,/workspace/patootie_code/mm_argfallacy/data/MMUSED-fallacy/audio_clips/33_2008/949.wav,"And I -- and I honestly don't believe that Senator Obama has the knowledge or experience and has made the wrong judgments in a number of areas, including his initial reaction to Russian invasion -- aggression in Georgia, to his -- you know, we've seen this stubbornness before in this administration to cling to a belief that somehow the surge has not succeeded and failing to acknowledge that he was wrong about the surge is -- shows to me that we -- that -- that we need more flexibility in a president of the United States than that.","And I honestly don't believe that Senator Obama has the knowledge or experience and has made the wrong judgments in a number of areas, including his initial reaction to Russian aggression in Georgia, to his, you know, we've seen the stubbornness before in this administration to cling to a belief that somehow the surge has not succeeded and failing to acknowledge that he was wrong about the surge shows to me that we need more flexibility in a president of the United States than that.",0.0869565217391304,92,85
33_2008,Slogans,/workspace/patootie_code/mm_argfallacy/data/MMUSED-fallacy/audio_clips/33_2008/907.wav,And this is the greatest country on Earth.,And this is the greatest country on Earth.,0.0,8,8
35_2008,AppealtoEmotion,/workspace/patootie_code/mm_argfallacy/data/MMUSED-fallacy/audio_clips/35_2008/41.wav,"And then long-term we've got to fix our health care system, we've got to fix our energy system that is putting such an enormous burden on families.","And then long term, we've got to fix our health care system, we've got to fix our energy system that is putting such an enormous burden on families.",0.074074074074074,27,28
35_2008,AppealtoEmotion,/workspace/patootie_code/mm_argfallacy/data/MMUSED-fallacy/audio_clips/35_2008/97.wav,"And that's why, for example, on tax policy, what I want to do is provide a middle class tax cut to 95 percent of working Americans, those who are working two jobs, people who are not spending enough time with their kids, because they are struggling to make ends meet.","And that's why, for example, on tax policy, what I want to do is provide a middle-class tax cut to 95% of working Americans, those who are working two jobs, people who are not spending enough time with their kids, because they are struggling to make ends meet.",0.06,50,48
35_2008,AppealtoEmotion,/workspace/patootie_code/mm_argfallacy/data/MMUSED-fallacy/audio_clips/35_2008/49.wav,"Americans are angry, they're upset, and they're a little fearful.","Americans are angry, they're upset, and they're a little fearful.",0.0,10,10
36_2008,AppealtoEmotion,/workspace/patootie_code/mm_argfallacy/data/MMUSED-fallacy/audio_clips/36_2008/44.wav,"Americans are hurting right now, and they're angry. They're hurting, and they're angry.",Americans are hurting right now and they're angry.,0.3846153846153846,13,8
36_2008,AppealtoEmotion,/workspace/patootie_code/mm_argfallacy/data/MMUSED-fallacy/audio_clips/36_2008/65.wav,I think everybody understands at this point that we are experiencing the worst financial crisis since the Great Depression.,"Well, first of all, I want to thank Hofstra University and the people of New York for hosting us tonight, and it's wonderful to join Senator McCain again. And thank you, Bob. I think everybody understands at this point that we are experiencing the worst financial crisis since the Great Depression. And the financial rescue plan that Senator McCain and I supported is an important first step. And I pushed for some core principles, making sure that taxpayers can get their money back. If they're putting money up, making sure that CEOs are not enriching themselves through this process.",4.2105263157894735,19,99
36_2008,AppealtoEmotion,/workspace/patootie_code/mm_argfallacy/data/MMUSED-fallacy/audio_clips/36_2008/142.wav,"We need to cut the business tax rate in America. We need to encourage business. Now, of all times in America, we need to cut people's taxes. We need to encourage business, create jobs, not spread the wealth around.",We need to cut the business tax rate in America.,0.7435897435897436,39,10
36_2008,FalseCause,/workspace/patootie_code/mm_argfallacy/data/MMUSED-fallacy/audio_clips/36_2008/51.wav,The catalyst for this housing crisis was the Fannie and Freddie Mae that caused subprime lending situation that now caused the housing market in America to collapse.,The catalyst for this housing crisis was the Fannie and Freddie May that caused subprime lending situation that now caused the housing market in America to collapse.,0.037037037037037,27,27
36_2008,AppealtoEmotion,/workspace/patootie_code/mm_argfallacy/data/MMUSED-fallacy/audio_clips/36_2008/179.wav,"But what is absolutely true is that, once we get through this economic crisis and some of the specific proposals to get us out of this slump, that we're not going to be able to go back to our profligate ways.","But what is absolutely true is that once we get through this economic crisis and some of the specific proposals to get us out of this slump, that we're not going to be able to go back to our profligate ways.",0.0,41,41
36_2008,AppealtoEmotion,/workspace/patootie_code/mm_argfallacy/data/MMUSED-fallacy/audio_clips/36_2008/217.wav,That's not the way we cut -- we'll cut out all the pork.,That's not the way we cut.,0.5,12,6
36_2008,AppealtoEmotion,/workspace/patootie_code/mm_argfallacy/data/MMUSED-fallacy/audio_clips/36_2008/229.wav,"There's no doubt that the system needs reform and there are a lot of screwy things that we end up spending money on, and they need to be eliminated.","There's no doubt that the system needs reform and there are a lot of screwy things that we end up spending money on, and they need to be eliminated.",0.0,29,29
36_2008,AppealtoEmotion,/workspace/patootie_code/mm_argfallacy/data/MMUSED-fallacy/audio_clips/36_2008/256.wav,"Now, look, Americans are hurting tonight and they're angry and I understand that, and they want a new direction.","Look, Americans are hurting tonight and they're angry. And I understand that. And they want a new direction.",0.0526315789473684,19,18
36_2008,AppealtoEmotion,/workspace/patootie_code/mm_argfallacy/data/MMUSED-fallacy/audio_clips/36_2008/262.wav,Let's look at it as graded by the National Taxpayers Union and the Citizens Against Government Waste and the other watchdog organizations.,Let's look at is graded by the National Taxpayers Union and the Citizens Against Government Waste and the other watchdog organizations.,0.0909090909090909,22,21
36_2008,AppealtoEmotion,/workspace/patootie_code/mm_argfallacy/data/MMUSED-fallacy/audio_clips/36_2008/278.wav,"So the fact of the matter is that if I occasionally have mistaken your policies for George Bush's policies, it's because on the core economic issues that matter to the American people, on tax policy, on energy policy, on spending priorities, you have been a vigorous supporter of President Bush.","So the fact of the matter is, is that if I occasionally mistaken your policies for George Bush's policies, it's because on the core economic issues that matter to the American people, on tax policy, on energy policy, on spending priorities, you have been a vigorous supporter of President Bush.",0.04,50,50
36_2008,AppealtoEmotion,/workspace/patootie_code/mm_argfallacy/data/MMUSED-fallacy/audio_clips/36_2008/306.wav,"Well, this has been a tough campaign. It's been a very tough campaign.","Well, this has been a tough campaign.",0.4615384615384615,13,7
36_2008,AppealtoEmotion,/workspace/patootie_code/mm_argfallacy/data/MMUSED-fallacy/audio_clips/36_2008/315.wav,"That, to me, was so hurtful.",That to me was so hurtful.,0.0,6,6
